2019/8471,"MAIN ROADS/Transport - Land/Road reserve, including existing roads, lots and easements/Western Australia/Bunbury Outer Ring Road Northern and Central Section Project, WA",Decision on approval of action: Approved with conditions,21/12/2020,Yes,No,Success,20198471_21122020_mr_doaoaawc,Yes
2020/8732,"Western Australian Department of Education/Commercial Development/Lambeth Circle, Wellard/Western Australia/Wellard Village Primary School development, part Lot 9074 Lambeth Circle, Wellard",Notification of Publication of Preliminary Documentation: Invitation to Comment,21/12/2020,Yes,No,Success,20208732_21122020_wadoe_nopopditc,Yes
2020/8765,"Lower Murray Urban and Rural Water Corporation/Water Management and Use/Murray-Sunset National Park, Old Mail Road, near Mildura/Victoria/Lindsay Island Floodplain Restoration Project, VIC",Decision on Assessment Approach: Accredited Assessment Process,21/12/2020,Yes,No,Success,20208765_21122020_lmuarwc_doaaaap,Yes
2014/7210,"MCARTHUR RIVER MINE PTY LTD/Mining/PPL 1051, 45 km south west of Borroloola/Northern Territory/Redesign & reconfiguration of Northern Overburden Emplacement Facility, NT",Notification of Variation to Approval,18/12/2020,Yes,No,Success,20147210_18122020_mrmpl_novta,Yes
2019/8520,"Department of Transport/Transport - Water/Port Hedland/Western Australia/Port Hedland Spoilbank Marina, WA",Notification of Publication of Final Preliminary Documentation,18/12/2020,Yes,No,Success,20198520_18122020_dot_nopofpd,Yes
2020/8771,"Lower Murray Urban and Rural Water Corporation/Water Management and Use/Brereton Road, Gunbower/Victoria/Gunbower National Park Floodplain Restoration Project",Decision on Assessment Approach: Accredited Assessment Process,18/12/2020,Yes,No,Success,20208771_18122020_lmuarwc_doaaaap,Yes
2020/8729,"Balmoral Parade Pty Ltd (a related entity of Allam Property Group)/Residential Development/at the foothills of the Illawarra Escarpment to the west of Albion Park, near Wollongong/New South Wales/Tullimbar subdivision, Stage 9, 21 km south-west of Wollongong, NSW",Decision whether action needs approval/Approval Not Required,17/12/2020,Yes,No,Success,20208729_17122020_bpplareoapg_dwanaanr,Yes
2020/8851,"Santos CSG Pty Ltd/Energy Generation and Supply (non-renewable)/50 km north of Injune, Towrie/Queensland/Towrie Gas Development",Suspension of Referral Decision Timeframe Period,17/12/2020,Yes,No,Success,20208851_17122020_scpl_sordtp,Yes
2019/8546,"Public Transport Authority of Western Australia/Transport - Land/63 Lots./Western Australia/Morley-Ellenbrook Rail Line Part 2, WA",Decision on approval of action: Approved with conditions,17/12/2020,Yes,No,Success,20198546_17122020_ptaowa_doaoaawc,Yes
2020/8829,Aquatec Pty Ltd/Aquaculture/near Cooktown/Queensland/Aquatec Pty Ltd prawn farm redevelopment Cooktown,Decision on Assessment Approach: Public Environment Report,16/12/2020,Yes,No,Success,20208829_16122020_apl_doaaper,Yes
2017/8112,"NW INTERCONNECTED POWER PTY LTD/Energy Generation and Supply (renewable)/UCL, Section 91 License LIC 00811/2015_A5683256/Western Australia/Asian Renewable Energy Hub, 220 km east of Port Hedland, Western Australia",Decision on approval of action: Approved with conditions,16/12/2020,Yes,No,Success,20178112_16122020_nippl_doaoaawc,Yes
2019/8601,"ATLAS IRON LIMITED/Mining/Various mining tenements, Pilbara/Western Australia/Miralga Creek Project, Pilbara region, WA",Assessment Process Notice: Extension of time in which to make a decision whether to approve a controlled action,16/12/2020,Yes,No,Success,20198601_16122020_ail_apneotiwtmadwtaaca,Yes
2020/8829,Aquatec Pty Ltd/Aquaculture/near Cooktown/Queensland/Aquatec Pty Ltd prawn farm redevelopment Cooktown,Decision whether action needs approval/Approval Required,16/12/2020,Yes,No,Success,20208829_16122020_apl_dwanaar,Yes
2020/8837,Rye Park Renewable Energy Pty Ltd/Energy Generation and Supply (renewable)/near Yass/New South Wales/Rye Park Wind Farm,Decision on Assessment Approach: Preliminary Documentation,16/12/2020,Yes,No,Success,20208837_16122020_rprepl_doaapd,Yes
2020/8837,Rye Park Renewable Energy Pty Ltd/Energy Generation and Supply (renewable)/near Yass/New South Wales/Rye Park Wind Farm,Decision whether action needs approval/Approval Required,16/12/2020,Yes,No,Success,20208837_16122020_rprepl_dwanaar,Yes
2019/8554,LIGHTSOURCE DEVELOPMENT SERVICES AUSTRALIA PTY LTD/Energy Generation and Supply (renewable)/Lower Wonga/Queensland/Woolooga Solar Farms,Notification of Publication of Preliminary Documentation: Invitation to Comment,15/12/2020,Yes,No,Success,20198554_15122020_ldsapl_nopopditc,Yes
2005/2132,GREATER GEELONG CITY COUNCIL/Agriculture and Forestry/Geelong/Victoria/Mosquito Control,Notification of Extension of Period of Effect of Approval,14/12/2020,Yes,No,Success,20052132_14122020_ggcc_noeopoeoa,Yes
2020/8765,"Lower Murray Urban and Rural Water Corporation/Water Management and Use/Murray-Sunset National Park, Old Mail Road, near Mildura/Victoria/Lindsay Island Floodplain Restoration Project, VIC",Statement of Reasons: Decision under section 75,14/12/2020,Yes,No,Success,20208765_14122020_lmuarwc_sordus7,Yes
2020/8662,"Port Arthur Historic Site Management Authority/Tourism and Recreation/16 Degraves and 23 Syme St, South Hobart/Tasmania/Cascades Female Factory History and Interpretation Centre",Final recommendation report completed,14/12/2020,No,No,Not Applicable,Not Applicable,Not Applicable
2017/8121,"Sapphire Solar Farm Pty Ltd/Energy Generation and Supply (renewable)/Multiple/New South Wales/Sapphire Solar Farm Project, 28km east of Inverell, NSW",Notification of Variation to Approval,14/12/2020,Yes,No,Success,20178121_14122020_ssfpl_novta,Yes
2020/8833,"Main Roads Western Australia/Transport - Land/Mitchell Freeway Southbound, between Ocean Reef Road to Hepburn Avenue, Perth/Western Australia/Mitchell Freeway Principal Shared Path Gaps Project Ocean Reef Road to Hepburn Avenue",Decision on Assessment Approach: Preliminary Documentation,11/12/2020,Yes,No,Success,20208833_11122020_mrwa_doaapd,Yes
2020/8645,"EMKC AU Industrial 2 Pty Ltd/Commercial Development/Robinsons Road Employment Area South precinct, Truganina/Victoria/489A Robinsons Road Truganina",Notification of Publication of Final Preliminary Documentation,11/12/2020,Yes,No,Success,20208645_11122020_eai2pl_nopofpd,Yes
2020/8833,"Main Roads Western Australia/Transport - Land/Mitchell Freeway Southbound, between Ocean Reef Road to Hepburn Avenue, Perth/Western Australia/Mitchell Freeway Principal Shared Path Gaps Project Ocean Reef Road to Hepburn Avenue",Decision whether action needs approval/Approval Required,11/12/2020,Yes,No,Success,20208833_11122020_mrwa_dwanaar,Yes
2020/8851,"Santos CSG Pty Ltd/Energy Generation and Supply (non-renewable)/50 km north of Injune, Towrie/Queensland/Towrie Gas Development",Invitation for Public Comment on Referral,11/12/2020,Yes,No,Success,20208851_11122020_scpl_ifpcor,Yes
2019/8408,"Orchard Development Management Pty Ltd/Residential Development/Lot 30 on SP309195, South Maclean, Qld/Queensland/Residential Development (Lot30, SP309195) Mountain Ridge Rd, South Maclean, Qld",Decision on approval of action: Approved with conditions,11/12/2020,Yes,No,Success,20198408_11122020_odmpl_doaoaawc,Yes
2020/8815,Snowy Monaro Regional Council/Waste Management (sewerage)/Adaminaby/New South Wales/Adaminaby Sewage Treatment Plant Upgrade,Suspension of Referral Decision Timeframe Period,11/12/2020,Yes,No,Success,20208815_11122020_smrc_sordtp,Yes
2020/8749,Fortescue Metals Group Ltd/Mining/Shire of Ashburton/Western Australia/Eliwana Iron Ore Mine,Decision whether action needs approval/Approval Not Required,11/12/2020,Yes,No,Success,20208749_11122020_fmgl_dwanaanr,Yes
2020/8831,Charters Towers Regional Council/Water Management and Use/the Burdekin River approximately 26 km north of Charters Towers/Queensland/Big Rocks Weir,Invitation for Public Comment on Referral,10/12/2020,Yes,No,Success,20208831_10122020_ctrc_ifpcor,Yes
2020/8750,"Lower Murray Urban and Rural Water Corporation/Water Management and Use/Murray-Sunset National Park, Wallpolla Island, 3490/Victoria/Wallpolla Island Floodplain Restoration Project",Statement of Reasons: Decision under section 75,10/12/2020,Yes,No,Success,20208750_10122020_lmuarwc_sordus7,Yes
2020/8825,"Transport for NSW/Transport - Water/La Perouse and Kurnell on either side of the ocean entrance within Kamay Botany Bay National Park, S/New South Wales/Kamay Ferry Wharves Project",Invitation for Public Comment on Referral,10/12/2020,Yes,No,Success,20208825_10122020_tfn_ifpcor,Yes
2019/8574,Australian War Memorial/Commonwealth/Campbell/Australian Capital Territory/Australian War Memorial Redevelopment,Decision on approval of action: Approved with conditions,10/12/2020,Yes,No,Success,20198574_10122020_awm_doaoaawc,Yes
2019/8402,"THE MINISTER FOR ECONOMIC DEVELOPMENT QUEENSLAND/Water Management and Use/Combination of road reserve and lots. Affected roads and lots listed in answer to question 1.5/Queensland/Willowbank Industrial Park Trunk Water Main, Ipswich, Qld",Notification of Publication of Preliminary Documentation: Invitation to Comment,09/12/2020,Yes,No,Success,20198402_09122020_tmfedq_nopopditc,Yes
2020/8838,"Viva Energy Gas Australia Pty Ltd/Energy Generation and Supply (non-renewable)/Corio Bay, Port of Geelong/Victoria/Viva Energy Gas Terminal Project",Invitation for Public Comment on Referral,09/12/2020,Yes,No,Success,20208838_09122020_vegapl_ifpcor,Yes
2016/7649,"Vickery Coal Pty Ltd/Mining/approx. 25km north of Gunnedah and 10km east of Boggabri/New South Wales/Vickery Coal Mine Extension Project, Gunnedah, NSW",Assessment Process Notice: Extension of time in which to make a decision whether to approve a controlled action,09/12/2020,Yes,No,Success,20167649_09122020_vcpl_apneotiwtmadwtaaca,Yes
2020/8811,Western Australian Land Authority/Commercial Development/Broome/Western Australia/Broome Road Industrial Estate,Decision whether action needs approval/Approval Not Required,09/12/2020,Yes,No,Success,20208811_09122020_wala_dwanaanr,Yes
2020/8843,"Mannum Stage 2 Subco Pty Ltd/Energy Generation and Supply (renewable)/135 Mannum Rd, Mannum/South Australia/Mannum Stage 2 Solar Farm",Invitation for Public Comment on Referral,08/12/2020,Yes,No,Success,20208843_08122020_ms2spl_ifpcor,Yes
2018/8141,"CLARKE CREEK ENERGY PTY LTD/Energy Generation and Supply (renewable)/Multiple lots/Queensland/Clarke Creek Wind Farm, Qld",Correction Notice,08/12/2020,Yes,No,Success,20188141_08122020_ccepl_cn,Yes
2017/8005,"TRANSPORT FOR NSW/Transport - Land/from Englands Rd connecting with upgraded Sapphire to Woolgoolga section/New South Wales/Pacific Highway Upgrade - Coffs Harbour Bypass, NSW",Decision on approval of action: Approved with conditions,08/12/2020,Yes,No,Success,20178005_08122020_tfn_doaoaawc,Yes
2020/8823,"Ironstone Developments Pty Ltd/Mining/279 Deep Creek Road, Limeburners Creek/New South Wales/Deep Creek Quarry, The Bucketts Way Road",Decision whether action needs approval/Approval Required,07/12/2020,Yes,No,Success,20208823_07122020_idpl_dwanaar,Yes
2020/8744,"Lower Murray Urban and Rural Water Corporation/Water Management and Use/The project is located on the Belsar-Yungera floodplain complex, near Robinvale/Victoria/Belsar-Yungera Floodplain Restoration Project, VIC",Statement of Reasons: Decision under section 75,07/12/2020,Yes,No,Success,20208744_07122020_lmuarwc_sordus7,Yes
2020/8823,"Ironstone Developments Pty Ltd/Mining/279 Deep Creek Road, Limeburners Creek/New South Wales/Deep Creek Quarry, The Bucketts Way Road",Decision on Assessment Approach: Not Applicable; Bilateral Agreement Applies,07/12/2020,No,No,Not Applicable,Not Applicable,Not Applicable
2017/7986,"KIMBERLEY TECHNOLOGY SOLUTIONS PTY LTD/Transport - Air and Space/N/A/Western Australia/Cockatoo Island Multi-User Supply Base, WA",Notification of Variation to Proposal,07/12/2020,Yes,No,Success,20177986_07122020_ktspl_novtp,Yes
2020/8824,"Department of Local Government, Sport and Cultural Industries/Tourism and Recreation/305 Welshpool Road, Queens Park, Canning/Western Australia/State Football Centre",Decision whether action needs approval/Approval Not Required - particular manner,07/12/2020,Yes,No,Success,20208824_07122020_dolgsaci_dwanaanrpm,Yes
2020/8780,"Kerrboyle Pty Ltd/Residential Development/Taylor Road and Adams Street, Mundijong/Western Australia/Residential development at Taylor Road and Adams Street, Mundijong, WA",Decision whether action needs approval/Approval Not Required,04/12/2020,Yes,No,Success,20208780_04122020_kpl_dwanaanr,Yes
2020/8844,"AGL Macquarie Pty Ltd/Energy Generation and Supply (non-renewable)/near Muswellbrook/New South Wales/Liddell Battery, Decoupling and Bayswater Ancillary Works",Invitation for Public Comment on Referral,04/12/2020,Yes,No,Success,20208844_04122020_ampl_ifpcor,Yes
2020/8690,"Peet No 121 Pty LIMITED/Residential Development/Shire of Murray, 20 km south of Mandurah, 8 km west of Pinjarra/Western Australia/Nirimba Rural Residential Development",Invitation for Public Comment on Referral,04/12/2020,Yes,No,Success,20208690_04122020_pn1pl_ifpcor,Yes
2020/8809,"City of Canning/Transport - Land/Grey Street, Cannington, WA, 6107, Australia/Western Australia/Southern Link Road Stage 3 City of Canning",Decision whether action needs approval/Approval Required,04/12/2020,Yes,No,Success,20208809_04122020_coc_dwanaar,Yes
2020/8840,"Uluru Lodge Walk Pty Ltd/Tourism and Recreation/1680 Uluru Rd, Petermann, Uluru (Ayers Rock) Kata Tjuta National Park/Northern Territory/Uluru Lodge Walk ULW",Invitation for Public Comment on Referral,04/12/2020,Yes,No,Success,20208840_04122020_ulwpl_ifpcor,Yes
2019/8548,STANMORE IP COAL PTY LTD/Mining/Approx. 5-7km east of Moranbah/Queensland/Isaac Plains East Extension,Decision on approval of action: Approved with conditions,04/12/2020,Yes,No,Success,20198548_04122020_sicpl_doaoaawc,Yes
2016/7698,"Main Roads Western Australia/Transport - Land/Toodyay Goomalling Rd (M060), Williams Narrogin Hway (H053) and Pinjarra Williams Rd (M053)/Western Australia/Widening maintenance zones for 3 roads, Wheatbelt region, WA",Decision on approval of action: Approved with conditions,03/12/2020,Yes,No,Success,20167698_03122020_mrwa_doaoaawc,Yes
2020/8834,"Austral Bricks WA Pty Ltd/Manufacturing/Kiln Rd/Western Australia/Bristile Holdings Pty Ltd, Cardup Brickworks, South of Byford",Invitation for Public Comment on Referral,03/12/2020,Yes,No,Success,20208834_03122020_abwpl_ifpcor,Yes
2020/8816,Sydney Water Corporation/Waste Management (sewerage)/The pipelines extend from Lansdowne to Warragamba. The AWRC site is between South and Kemps Creeks./New South Wales/Upper South Creek Advanced Water Recycling Centre,Decision whether action needs approval/Approval Required,03/12/2020,Yes,No,Success,20208816_03122020_swc_dwanaar,Yes
2020/8832,"Melton City Council/Tourism and Recreation/783 Coburns Rd, Toolern Vale/Victoria/MacPherson Park Recreation Reserve, Coburns Road, Harkness",Invitation for Public Comment on Referral,03/12/2020,Yes,No,Success,20208832_03122020_mcc_ifpcor,Yes
2020/8845,"Department for Infrastructure and Transport, Government of South Australia/Transport - Land/Granite Island Road, Victor Harbor/South Australia/Granite Island Causeway Project",Invitation for Public Comment on Referral,03/12/2020,Yes,No,Success,20208845_03122020_dfiatgosa_ifpcor,Yes
2020/8816,Sydney Water Corporation/Waste Management (sewerage)/The pipelines extend from Lansdowne to Warragamba. The AWRC site is between South and Kemps Creeks./New South Wales/Upper South Creek Advanced Water Recycling Centre,Decision on Assessment Approach: Not Applicable; Bilateral Agreement Applies,03/12/2020,No,No,Not Applicable,Not Applicable,Not Applicable
2017/8049,"DEPARTMENT OF JUSTICE AND REGULATION/Residential Development/5 lots – 4 freehold and 1 unreserved Crown land/Victoria/Youth Justice Redevelopment Project, Cherry Creek, 10 kms south west of Werribee, VIC.",Notification of Variation to Approval,02/12/2020,Yes,No,Success,20178049_02122020_dojar_novta,Yes
2008/4480,TENAX ENERGY PTY LTD/Energy Generation and Supply (renewable)/Within the Entrance of Port Phillip Bay/Victoria/Offshore Tidal Energy Facility and Submarine Cable,Notification to Lapse,01/12/2020,Yes,No,Success,20084480_01122020_tepl_ntl,Yes
2020/8775,"Caves Road 1676 Pty Ltd/Tourism and Recreation/Caves Road, Dunsborough/Western Australia/Lot 200 Caves Road Tourist Accommodation",Decision whether action needs approval/Approval Not Required,01/12/2020,Yes,No,Success,20208775_01122020_cr1pl_dwanaanr,Yes
2019/8552,"LENDLEASE COMMUNITIES (WERRINGTON) PTY LIMITED/Residential Development/16 Chapman Street, Werrington/New South Wales/Chapman Street Residential Development",Notification of Variation to Approval,01/12/2020,Yes,No,Success,20198552_01122020_lcwpl_novta,Yes
2019/8529,"MAIN ROADS/Transport - Land/Hale Road, Forrestfield and Welshpool Road, Wattle Grove/Western Australia/Tonkin Highway Grade Separated Interchanges",Notification of Variation to Proposal,01/12/2020,Yes,No,Success,20198529_01122020_mr_novtp,Yes
2019/8582,"Major Projects Canberra/Transport - Land/Northbourne Avenue, London Circuit (West) and Commonwealth Avenue/Australian Capital Territory/City to Commonwealth Park Light Rail 2A",Assessment Process Notice: Extension of time in which to make a decision whether to approve a controlled action,01/12/2020,Yes,No,Success,20198582_01122020_mpc_apneotiwtmadwtaaca,Yes
2017/7922,"Coachtrail Investments Pty Ltd/Mining/Gin Gin/Queensland/Proposed expansion of extractive operation, Clarkes Road, Gin Gin, Qld",Notification of Variation to Approval,30/11/2020,Yes,No,Success,20177922_30112020_cipl_novta,Yes
2017/8017,"ROBE RIVER MINING CO PTY LTD/Mining/16 km SW Pannawonica/Western Australia/Development of the Mesa H iron ore mining operations, WA",Notification of Variation to Approval,30/11/2020,Yes,No,Success,20178017_30112020_rrmcpl_novta,Yes
2020/8820,Department of Transport/Transport - Land/Lot 3 on Plan of Subdivision 331541/Victoria/Fitzgerald Road level crossing removal,Decision whether action needs approval/Approval Not Required,30/11/2020,Yes,No,Success,20208820_30112020_dot_dwanaanr,Yes
2020/8818,"Sun Cable Pty Ltd/Energy Generation and Supply (renewable)/Extending from Elliot in regional Northern Territory, through Darwin and across to Singapore/Northern Territory/Australia-ASEAN Power Link",Decision whether action needs approval/Approval Required,30/11/2020,Yes,No,Success,20208818_30112020_scpl_dwanaar,Yes
2013/6978,"MT OWEN PTY LTD/Mining/Mt Owen, Upper Hunter Valley/New South Wales/Mt Owen continued coal mining operation",Notification of Variation to Approval,30/11/2020,Yes,No,Success,20136978_30112020_mopl_novta,Yes
2019/8582,"Major Projects Canberra/Transport - Land/Northbourne Avenue, London Circuit (West) and Commonwealth Avenue/Australian Capital Territory/City to Commonwealth Park Light Rail 2A",Notification of Publication of Final Preliminary Documentation,30/11/2020,Yes,No,Success,20198582_30112020_mpc_nopofpd,Yes
2013/6979,"SH CAMDEN LAKESIDE P/L/Residential Development/Cnr Raby Rd and Camden Valley Way, Gledswood Hills/New South Wales/Urban & recreational Development (El Caballo Blanco, Gledswood & Lakeside), Gledswood, NSW",Notification of Variation to Approval,30/11/2020,Yes,No,Success,20136979_30112020_sclp_novta,Yes
2017/7875,"Lendlease Communities (Springfield) Pty Ltd/Residential Development/Sinnathamby Boulevard, Springfield/Queensland/Woogaroo Heights master planned residential development, Springfield, Qld",Decision on approval of action: Approved with conditions,30/11/2020,Yes,No,Success,20177875_30112020_lcspl_doaoaawc,Yes
2020/8822,Transport Canberra and City Services/Transport - Land/Morisset Road between Flemington Road and Federal Highway/Australian Capital Territory/Morisset Road Extension and Sullivans Creek Retardation Basin,Decision whether action needs approval/Approval Required,27/11/2020,Yes,No,Success,20208822_27112020_tcacs_dwanaar,Yes
2017/7957,"BHP Billiton Mitsui Coal Pty Ltd/Mining/Lot 3 SP162563, Lot 7 SP155252, Lot 2 WHS16/Queensland/MRA2C Project, South Walker Creek Operations",Notification of Variation to Approval,27/11/2020,Yes,No,Success,20177957_27112020_bbmcpl_novta,Yes
2020/8841,"Sylvanvale Foundation/Residential Development/147 Garnet Road, Kareela/New South Wales/Kareela, Garnet Road Rezoning",Invitation for Public Comment on Referral,27/11/2020,Yes,No,Success,20208841_27112020_sf_ifpcor,Yes
2020/8779,"Delfina Properties Pty Ltd/Residential Development/Various Lots Doley Road, Orton Road and Lawrence Way, Beenyup Grove, Byford/Western Australia/Residential Development Various Lots Doley Road, Orton Road and Lawrence Way, Beenyup Grove Byford, Western Australia",Decision whether action needs approval/Approval Not Required,27/11/2020,Yes,No,Success,20208779_27112020_dppl_dwanaanr,Yes
2018/8262,"Public Transport Authority of Western Australia/Transport - Land/Yanchep/Western Australia/Yanchep Rail Extension, WA",Notification of Variation to Approval,27/11/2020,Yes,No,Success,20188262_27112020_ptaowa_novta,Yes
2019/8584,"Calidus Resources Limited/Mining/Various mining, exploration and prospecting leases, as outlined in Section 2.2 of the SIR/Western Australia/Warrawoona Gold Project, Pilbara Region, WA",Assessment Process Notice: Extension of time in which to make a decision whether to approve a controlled action,27/11/2020,Yes,No,Success,20198584_27112020_crl_apneotiwtmadwtaaca,Yes
2020/8822,Transport Canberra and City Services/Transport - Land/Morisset Road between Flemington Road and Federal Highway/Australian Capital Territory/Morisset Road Extension and Sullivans Creek Retardation Basin,Decision on Assessment Approach: Preliminary Documentation,27/11/2020,Yes,No,Success,20208822_27112020_tcacs_doaapd,Yes
2020/8826,BRISBANE AIRPORT CORPORATION/Transport - Air and Space/Brisbane Airport/Queensland/Airport Industrial Park 2,Decision on Assessment Approach: Accredited Assessment Process,26/11/2020,Yes,No,Success,20208826_26112020_bac_doaaaap,Yes
2020/8826,BRISBANE AIRPORT CORPORATION/Transport - Air and Space/Brisbane Airport/Queensland/Airport Industrial Park 2,s161- Advice required,26/11/2020,No,No,Not Applicable,Not Applicable,Not Applicable
2018/8300,"BULGA COAL MANAGEMENT PTY LIMITED/Mining/Broke Road, Pokolbin, NSW, 2320/New South Wales/Bulga Coal Optimisation Project Modification, near Singleton, NSW",Correction notice,25/11/2020,Yes,No,Success,20188300_25112020_bcmpl_cn,Yes
2012/6558,Gladstone Ports Corporation Ltd/Transport - Water/Port of Gladstone/Queensland/Port of Gladstone Gatcombe & Golding Cutting Channel Duplication Project,Assessment Process Notice: Extension of time in which to make a decision whether to approve a controlled action,25/11/2020,Yes,No,Success,20126558_25112020_gpcl_apneotiwtmadwtaaca,Yes
2014/7263,"Public Transport Victoria/Transport - Land/Ryans Road South, Pakenham East/Victoria/Pakenham East Stabling & Maintenance Depot, Pakenham, VIC",Correction notice,24/11/2020,Yes,No,Success,20147263_24112020_ptv_cn,Yes
2014/7376,"SANTOS NSW EASTERN PTY LTD/Energy Generation and Supply (non-renewable)/approximately 20 and 45kms south of Narrabri/New South Wales/Narrabri Gas Project, approx 20 and 45kms south of Narrabri, NSW",Decision on approval of action: Approved with conditions,24/11/2020,Yes,No,Success,20147376_24112020_snepl_doaoaawc,Yes
2016/7751,"Scott Harris/Natural Resources Management/Cape York, West of Laura/Queensland/Clearing of vegetation at Kingvale Station (Lot 1 on Survey Plan 280074, QLD) and related activities",Decision on approval of action: Not Approved,24/11/2020,Yes,No,Success,20167751_24112020_sh_doaoana,Yes
2010/5479,"LandCorp/Residential development/Lots 1523 and 3000, Emu Point Drive, Albany/WA/Emu Point Residential Area Project",Notification of Proposal Withdrawn,23/11/2020,No,No,Not Applicable,Not Applicable,Not Applicable
2017/8090,"Pointcorp Heritage Park Pty Limited/Residential Development/64.750/Queensland/Park Ridge residential, mixed use and medium impact industry precinct, Park Ridge, Queensland",Decision on approval of action: Approved with conditions,23/11/2020,Yes,No,Success,20178090_23112020_phppl_doaoaawc,Yes
2018/8258,"WOLLAR SOLAR DEVELOPMENT PTY LTD/Energy Generation and Supply (renewable)/Multiple lots, approximately 7km from Wollar, NSW/New South Wales/Wollar Solar Farm, near Wollar, NSW",Correction notice,23/11/2020,Yes,No,Success,20188258_23112020_wsdpl_cn,Yes
2019/8520,"Department of Transport/Transport - Water/Port Hedland/Western Australia/Port Hedland Spoilbank Marina, WA",Notification of Publication of Preliminary Documentation: Invitation to Comment,23/11/2020,Yes,No,Success,20198520_23112020_dot_nopopditc,Yes
2019/8424,"Cairns Regional Council/Natural Resources Management/151 Abbott Street, Cairns City, QLD, 4870/Queensland/Flying-fox relocation measures, 151 Abbott Street, Cairns, Qld",Correction notice,23/11/2020,Yes,No,Success,20198424_23112020_crc_cn,Yes
2020/8662,"Port Arthur Historic Site Management Authority/Tourism and Recreation/16 Degraves and 23 Syme St, South Hobart/Tasmania/Cascades Female Factory History and Interpretation Centre",Notification of Publication of Final Preliminary Documentation,23/11/2020,Yes,No,Success,20208662_23112020_pahsma_nopofpd,Yes
2020/8695,"Kirman Pty Ltd/Residential Development/located at Old Post Office Road, Cattai/New South Wales/Old Post Office Road, Cattai",Suspension of Referral Decision Timeframe Period,23/11/2020,Yes,No,Success,20208695_23112020_kpl_sordtp,Yes
2018/8188,"Public Transport Authority of Western Australia/Transport - Land/Various/Western Australia/Thornlie-Cockburn Link Project, WA",Notification of Variation to Approval,21/11/2020,Yes,No,Success,20188188_21112020_ptaowa_novta,Yes
