2019/8549,FUTURA RESOURCES LIMITED/Mining/Bowen Basin/Queensland/Fairhill Coal Project,Assessment Process Notice: Guidelines issued,05/05/2020,Yes,No,Success,20198549_05052020_frl_apngi,Yes
2020/8639,Tamworth Solar Farm Pty Ltd/Energy Generation and Supply (renewable)/Near Somerton/New South Wales/Tamworth Solar Farm,Invitation for Public Comment on Referral,05/05/2020,Yes,No,Success,20208639_05052020_tsfpl_ifpcor,Yes
2018/8206,"TALISON LITHIUM AUSTRALIA PTY LTD/Exploration (mineral, oil and gas - non-marine)/Mulitple mining leases/Western Australia/Greenbushes Lithium mine expansion, 80 km SE of Bunbury, WA",Notification of Variation to Approval,05/05/2020,Yes,No,Success,20188206_05052020_tlapl_novta,Yes
2012/6303,"New Hope Corporation Limited/Mining/Bowen Basin Coalfields, 20km south of Glenden/QLD/New Lenton Coal Project",Notification of Proposal Withdrawn,05/05/2020,No,No,Not Applicable,Not Applicable,Not Applicable
2013/6885,"ADANI MINING PTY LTD/Transport - Land/from proposed Carmichael Mine to Port of Abbot Point/Queensland/North Galilee Basin Rail Project, Qld",Notification of Variation to Approval,04/05/2020,Yes,No,Success,20136885_04052020_ampl_novta,Yes
2020/8615,"CLAG Pty Ltd/Residential Development/Flinders View, Ipswich/Queensland/Ripley View Residential Subdivision",Invitation for Public Comment on Referral,04/05/2020,Yes,No,Success,20208615_04052020_cpl_ifpcor,Yes
2020/8650,Star of the South Wind Farm Pty Ltd (ABN 71623105091) as Trustee of the Star of the South Trust (ABN 68239717297)/Energy Generation and Supply (renewable)/Victorian land and coastal waters; Commonwealth waters/Commonwealth Marine/Star of the South Offshore Wind Farm Project,Invitation for Public Comment on Referral,04/05/2020,Yes,No,Success,20208650_04052020_sotswfpla7atotsotsta6_ifpcor,Yes
2019/8590,"Water NSW/Water Management and Use/The Peel River, downstream of Chaffey Dam to the confluence of the Peel and Namoi Rivers/New South Wales/Operation of Peel River Drought Protection Works",Notification of Publication of Final Preliminary Documentation,01/05/2020,Yes,No,Success,20198590_01052020_wn_nopofpd,Yes
2019/8581,"Drew Rolfe/Agriculture and Forestry/Wealwandangie Road, near Springsure/Queensland/Derrillo Irrigation Project",Decision whether action needs approval/Approval Required,01/05/2020,Yes,No,Success,20198581_01052020_dr_dwanaar,Yes
2019/8610,"Consolidated Minerals Pty Ltd/Mining/26 mining leases (M), 17 general purpose leases (G) and one miscellaneous licence/Western Australia/Woodie Continued Operations Project, East Pilbara, WA",Invitation for Public Comment on Referral,01/05/2020,Yes,No,Success,20198610_01052020_cmpl_ifpcor,Yes
2019/8581,"Drew Rolfe/Agriculture and Forestry/Wealwandangie Road, near Springsure/Queensland/Derrillo Irrigation Project",Decision on Assessment Approach: Preliminary Documentation,01/05/2020,Yes,No,Success,20198581_01052020_dr_doaapd,Yes
2018/8223,"ARROW ENERGY PTY LTD/Energy Generation and Supply (renewable)/51 Lots/Queensland/Surat Gas Project off-tenure pipelines, Surat Basin, Qld",Assessment Process Notice: Extension of time in which to make a decision whether to approve a controlled action,30/04/2020,Yes,No,Success,20188223_30042020_aepl_apneotiwtmadwtaaca,Yes
2018/8368,"RES AUSTRALIA PTY LTD/Energy Generation and Supply (renewable)/Warrego Highway 7km east of the township of Dulacca, Queensland/Queensland/Dulacca Renewable Energy Project, Dulacca QLD",Notification of Publication of Preliminary Documentation: Invitation to Comment,30/04/2020,Yes,No,Success,20188368_30042020_rapl_nopopditc,Yes
2017/7869,"PEMBROKE RESOURCES SOUTH PTY LTD/Mining/Peak Downs Highway, Moranbah, QLD, 4752/Queensland/Olive Downs Project Electricity Transmission Line",Decision on approval of action: Approved with conditions,30/04/2020,Yes,No,Success,20177869_30042020_prspl_doaoaawc,Yes
2020/8612,"Delburn Wind Farm Pty Ltd/Energy Generation and Supply (renewable)/South of Moe, Victoria: Hernes Oak (north), Thorpdale to (west), Darlimurla (south), Boolara (east)/Victoria/Delburn Wind Farm, Vic",Invitation for Public Comment on Referral,30/04/2020,Yes,No,Success,20208612_30042020_dwfpl_ifpcor,Yes
2019/8560,Urban Resources Pty Ltd/Mining/Mariginiup/Western Australia/Boundary Road Sand Quarry,Notification of Proposal Withdrawn,30/04/2020,No,No,Not Applicable,Not Applicable,Not Applicable
2019/8522,"BORAL BRICKS WESTERN AUSTRALIA PTY LTD/Mining/Lot M1326/Western Australia/Boral Bricks Western Australia Pty Ltd, Muchea East Road, Muchea, Western Australia",Decision whether action needs approval/Approval Not Required,30/04/2020,Yes,No,Success,20198522_30042020_bbwapl_dwanaanr,Yes
2019/8607,"juwi Renewable Energy Pty Ltd/Energy Generation and Supply (renewable)/Lot 12 RP18062 and Lot 15 RP101952, Yapunya Road, Dulacca/Queensland/Dulacca Solar Farm",Invitation for Public Comment on Referral,30/04/2020,Yes,No,Success,20198607_30042020_jrepl_ifpcor,Yes
2019/8552,"LENDLEASE COMMUNITIES (WERRINGTON) PTY LIMITED/Residential Development/16 Chapman Street, Werrington/New South Wales/Chapman Street Residential Development",Notification of Publication of Preliminary Documentation: Invitation to Comment,30/04/2020,Yes,No,Success,20198552_30042020_lcwpl_nopopditc,Yes
2018/8258,"WOLLAR SOLAR DEVELOPMENT PTY LTD/Energy Generation and Supply (renewable)/Multiple lots, approximately 7km from Wollar, NSW/New South Wales/Wollar Solar Farm, near Wollar, NSW",Assessment Process Notice: Extension of time in which to make a decision whether to approve a controlled action,29/04/2020,Yes,No,Success,20188258_29042020_wsdpl_apneotiwtmadwtaaca,Yes
2019/8593,"Defence Housing Australia/Residential Development/2 Burt Street, Fremantle, WA, 6160, Australia/Western Australia/Disposal of residential properties, Fremantle, WA",Invitation for Public Comment on Referral,28/04/2020,Yes,No,Success,20198593_28042020_dha_ifpcor,Yes
2019/8570,BHP BILLITON OLYMPIC DAM CORPORATION PTY LTD/Mining/near Roxby Downs/South Australia/Olympic Dam Resource Development Project,Statement of Reasons: Decision under section 75 and section 87,28/04/2020,Yes,No,Success,20198570_28042020_bbodcpl_sordus7as8,Yes
2014/7154,"SOUTHERN IRON PTY LTD/Mining/90km southeast of Coober Pedy, SA/South Australia/Expansion of Peculiar Knob Iron Ore Project, 90 south east of Coober Pedy, SA",Notification of Extension of Period of Effect of Approval,28/04/2020,Yes,No,Success,20147154_28042020_sipl_noeopoeoa,Yes
2014/7154,"SOUTHERN IRON PTY LTD/Mining/90km southeast of Coober Pedy, SA/South Australia/Expansion of Peculiar Knob Iron Ore Project, 90 south east of Coober Pedy, SA",Notification of Variation to Approval,28/04/2020,Yes,No,Success,20147154_28042020_sipl_novta,Yes
2020/8614,"Neoen Australia Pty Ltd/Energy Generation and Supply (non-renewable)/680 Ballan Rd, Moorabool/Victoria/Victorian Big Battery",Invitation for Public Comment on Referral,28/04/2020,Yes,No,Success,20208614_28042020_napl_ifpcor,Yes
2017/8004,"ARGYLE CATTLE COMPANY PTY LTD/Agriculture and Forestry/Lot 590 on Plan 69368/Western Australia/Shamrock Station Irrigation Project, west Kimberley region, WA",Notification of Publication of Preliminary Documentation: Invitation to Comment,24/04/2020,Yes,No,Success,20178004_24042020_accpl_nopopditc,Yes
2019/8417,"Air Trunk Pty Ltd as Trustee for the AirTrunk Melbourne Land Trust /Commercial Development/210 Swann Drive, Derrimut, VIC, 3030/Victoria/Commercial Development, 210 Swann Drive, Derrimut, Vic",Notification of Transfer of Approval to Air Trunk Pty Ltd as Trustee for the AirTrunk Melbourne Land Trust,24/04/2020,Yes,No,Success,20198417_24042020_atplatftamlt_notoatatplatftamlt,Yes
2019/8573,Department of Transport and Main Roads/Transport - Land/Bruce Highway between Smiths Gap and Friday Pocket Road/Queensland/Bruce Highway - Smiths Gap Overtaking Lane and Fauna Crossing,Decision whether action needs approval/Approval Not Required,24/04/2020,Yes,No,Success,20198573_24042020_dotamr_dwanaanr,Yes
2019/8579,Lockyer Valley Regional Council/Tourism and Recreation/L902 SP309246/Queensland/Fairways Park,Decision whether action needs approval/Approval Not Required,24/04/2020,Yes,No,Success,20198579_24042020_lvrc_dwanaanr,Yes
2019/8601,"ATLAS IRON LIMITED/Mining/Various mining tenements, Pilbara/Western Australia/Miralga Creek Project, Pilbara region, WA",Decision whether action needs approval/Approval Required,24/04/2020,Yes,No,Success,20198601_24042020_ail_dwanaar,Yes
2019/8542,"RBWI PTY LTD/Residential Development/Part of Lot 1 DP 558196/New South Wales/Calderwood Clover Hill Estate Subdivision, Wollongong",Statement of Reasons: Decision under section 75,24/04/2020,Yes,No,Success,20198542_24042020_rpl_sordus7,Yes
2019/8595,"INVOCARE AUSTRALIA PTY LIMITED/Commercial Development/Block 1, Section 3, Symonston, ACT./Australian Capital Territory/South Canberra Memorial Park",Invitation for Public Comment on Referral,24/04/2020,Yes,No,Success,20198595_24042020_iapl_ifpcor,Yes
2018/8254,"Geographe Property Pty Ltd/Residential Development/Lot 120 and Lot 121 Minninup Road, Dalyellup, Western Australia/Western Australia/Residential development, Lots 120-121 Minninup Road, Dalyellup WA",Decision whether action needs approval/Approval Not Required,23/04/2020,Yes,No,Success,20188254_23042020_gppl_dwanaanr,Yes
2019/8532,JUWI RENEWABLE ENERGY PTY LTD/Energy Generation and Supply (renewable)/near Chinchilla/Queensland/Chances Plain Solar Farm Project,Decision whether action needs approval/Approval Not Required,23/04/2020,Yes,No,Success,20198532_23042020_jrepl_dwanaanr,Yes
2019/8388,"B. & J. CATALANO PTY LTD/Mining/Lots 4 and 5 on Deposited Plan 15419; Vol 1884, Folio 210/Western Australia/Extension of Lots 4 & 5 Ludlow Road Limestone Extraction, Myalup, WA",Notification of Publication of Preliminary Documentation: Invitation to Comment,23/04/2020,Yes,No,Success,20198388_23042020_bjcpl_nopopditc,Yes
2020/8632,"Lower Murray Urban and Rural Water Corporation/Water Management and Use/Kulkyne Way, Red Cliffs/Victoria/Hattah Lakes North Floodplain Restoration Project",Invitation for Public Comment on Referral,23/04/2020,Yes,No,Success,20208632_23042020_lmuarwc_ifpcor,Yes
2017/8022,"AUSBUILD DEVELOPMENT CORP PTY LTD/Residential Development/Multiple properties - refer Lot and RP descriptions on Figure 2. /Queensland/Warner Road Residential Development, Warner, Qld",Notification of Variation to Proposal,22/04/2020,Yes,No,Success,20178022_22042020_adcpl_novtp,Yes
2018/8139,"JELLINBAH GROUP PTY LTD/Mining/Freeholds: 6 LR94, 100 SP230773, 2 SP213140, 3 SP213140/Queensland/Jellinbah Coal Mine-Central North Extension, QLD",Decision on approval of action: Approved with conditions,22/04/2020,Yes,No,Success,20188139_22042020_jgpl_doaoaawc,Yes
2019/8589,Woolnorth Wind Farm Holding Pty Ltd/Energy Generation and Supply (renewable)/Near Mortlake/Victoria/Mt Fyans Wind Farm,Decision on Assessment Approach: Not Applicable; Bilateral Agreement Applies,22/04/2020,No,No,Not Applicable,Not Applicable,Not Applicable
2019/8424,"Cairns Regional Council/Natural Resources Management/151 Abbott Street, Cairns City, QLD, 4870/Queensland/Flying-fox relocation measures, 151 Abbott Street, Cairns, Qld",Final recommendation report completed,22/04/2020,No,No,Not Applicable,Not Applicable,Not Applicable
2019/8589,Woolnorth Wind Farm Holding Pty Ltd/Energy Generation and Supply (renewable)/Near Mortlake/Victoria/Mt Fyans Wind Farm,Decision whether action needs approval/Approval Required,22/04/2020,Yes,No,Success,20198589_22042020_wwfhpl_dwanaar,Yes
2019/8533,Mario Michele Giacci/Mining/Myalup State Forest (16)/Western Australia/Bagieau Road Limestone Quarry,Decision on Assessment Approach: Preliminary Documentation,22/04/2020,Yes,No,Success,20198533_22042020_mmg_doaapd,Yes
2012/6558,Gladstone Ports Corporation Ltd/Transport - Water/Port of Gladstone/Queensland/Port of Gladstone Gatcombe & Golding Cutting Channel Duplication Project,Assessment Process Notice: Extension of time in which to make a decision whether to approve a controlled action,21/04/2020,Yes,No,Success,20126558_21042020_gpcl_apneotiwtmadwtaaca,Yes
2019/8577,"Melbourne Water Corporation/Water Management and Use/Crown Land, all managed by Melbourne Water/Victoria/WTP 115E Lagoon Seawall, Western Treatment Plant WTP, Werribee Victoria",Decision whether action needs approval/Approval Not Required,21/04/2020,Yes,No,Success,20198577_21042020_mwc_dwanaanr,Yes
2019/8536,TOWNSVILLE CITY COUNCIL/Waste Management (sewerage)/Lot 2 RP721497 /Queensland/Magnetic Island Water Reuse Project,Invitation for Public Comment on Referral,21/04/2020,Yes,No,Success,20198536_21042020_tcc_ifpcor,Yes
2018/8289,"NEOEN AUSTRALIA PTY. LTD./Energy Generation and Supply (renewable)/Refer to Kaban Green Power Hub Matters of Environmental Significance Report, Section 1.4./Queensland/Kaban Green Power Hub, Kaban, Qld",Decision on approval of action: Approved with conditions,21/04/2020,Yes,No,Success,20188289_21042020_napl_doaoaawc,Yes
2020/8623,AGL Macquarie Pty Ltd/Energy Generation and Supply (non-renewable)/Muswellbrook/New South Wales/Bayswater Power Station Water Infrastructure Upgrade,Decision on Assessment Approach: Not Applicable; Bilateral Agreement Applies,20/04/2020,No,No,Not Applicable,Not Applicable,Not Applicable
2020/8623,AGL Macquarie Pty Ltd/Energy Generation and Supply (non-renewable)/Muswellbrook/New South Wales/Bayswater Power Station Water Infrastructure Upgrade,Decision whether action needs approval/Approval Required,20/04/2020,Yes,No,Success,20208623_20042020_ampl_dwanaar,Yes
2017/7941,"Department of Transport and Main Roads/Transport - Land/Gazetted Future State-Controlled, Gympie, QLD, 4570/Queensland/Bruce Highway Cooroy to Curra (Section D: Woondum to Curra)",Notification of Variation to Approval,20/04/2020,Yes,No,Success,20177941_20042020_dotamr_novta,Yes
2017/8114,"ALCAN GOVE PTY LIMITED/Mining/NT Portion 1208 and NT Portion 7115(A)/Northern Territory/Borrow area development, Gove operations, Rio Tinto Aluminium, Nhulunbuy NT",Reconsideration of Referral Determination: S78 Reconsideration Decision,20/04/2020,Yes,No,Success,20178114_20042020_agpl_rordsrd,Yes
2019/8608,"Main Roads Western Australia/Transport - Land/Oakford and Mundijong, WA/Western Australia/Tonkin Highway Extension – Thomas Road to South Western Highway",Decision whether action needs approval/Approval Required,19/04/2020,Yes,No,Success,20198608_19042020_mrwa_dwanaar,Yes
2019/8608,"Main Roads Western Australia/Transport - Land/Oakford and Mundijong, WA/Western Australia/Tonkin Highway Extension – Thomas Road to South Western Highway",Decision on Assessment Approach: Preliminary Documentation,19/04/2020,Yes,No,Success,20198608_19042020_mrwa_doaapd,Yes
2018/8139,"JELLINBAH GROUP PTY LTD/Mining/Freeholds: 6 LR94, 100 SP230773, 2 SP213140, 3 SP213140/Queensland/Jellinbah Coal Mine-Central North Extension, QLD",Assessment Process Notice: Extension of time in which to make a decision whether to approve a controlled action,17/04/2020,Yes,No,Success,20188139_17042020_jgpl_apneotiwtmadwtaaca,Yes
2017/8052,"ROADS CORPORATION/Transport - Land/21A PARISH OF MARYVALE and 3C PARISH OF BOOLA BOOLA/Victoria/Latrobe River Bridge Replacement Project, Tyers Road, Vic",Assessment Process Notice: Extension of time in which to make a decision whether to approve a controlled action,17/04/2020,Yes,No,Success,20178052_17042020_rc_apneotiwtmadwtaaca,Yes
2019/8579,Lockyer Valley Regional Council/Tourism and Recreation/L902 SP309246/Queensland/Fairways Park,Correction Notice,17/04/2020,Yes,No,Success,20198579_17042020_lvrc_cn,Yes
2018/8367,"MAIN ROADS/Transport - Land/Hester Avenue/Wanneroo Road, Nowergup, WA, 6032/Western Australia/Mitchell Freeway Extension and Wanneroo Road Upgrade, WA",Notification of Publication of Final Preliminary Documentation,16/04/2020,Yes,No,Success,20188367_16042020_mr_nopofpd,Yes
2019/8583,ElectraNet/Energy Generation and Supply (non-renewable)/between Cultana and Port Lincoln/South Australia/Eyre Peninsula Transmission Line,Invitation for Public Comment on Referral,15/04/2020,Yes,No,Success,20198583_15042020_e_ifpcor,Yes
2017/8008,"Department of Economic Development, Jobs, Transport, and Resources (Major Road Projects Authority)/Transport - Land/Hume Freeway and O'Herns Road, Epping, VIC, 3076/Victoria/O'Herns Road and Hume Freeway Interchange Project, Vic",Notification of Variation to Approval,15/04/2020,Yes,No,Success,20178008_15042020_doedjtarmrpa_novta,Yes
2018/8158,"PANORAMA INVESTMENT (ALBANVALE) PTY LTD/Residential Development/80A and 80B Oakwood Drive, Albanvale, VIC, 3021/Victoria/Residential development 80a and 80b Oakwood Road, Albanvale, Vic",Notification of Publication of Preliminary Documentation: Invitation to Comment,14/04/2020,Yes,No,Success,20188158_14042020_piapl_nopopditc,Yes
2019/8548,STANMORE IP COAL PTY LTD/Mining/Approx. 5-7km east of Moranbah/Queensland/Isaac Plains East Extension,Assessment Process Notice: Guidelines issued,14/04/2020,Yes,No,Success,20198548_14042020_sicpl_apngi,Yes
2017/7870,"PEMBROKE RESOURCES SOUTH PTY LTD/Mining/Off the Norwich Park Branch Rail, Moranbah, QLD, 4752/Queensland/Olive Downs Project Rail Spur",Decision on approval of action: Approved with conditions,14/04/2020,Yes,No,Success,20177870_14042020_prspl_doaoaawc,Yes
2017/7868,"PEMBROKE RESOURCES SOUTH PTY LTD/Mining/Peak Downs Mine Road, Moranbah, QLD, 4744/Queensland/Olive Downs Project Water Pipeline",Decision on approval of action: Approved with conditions,14/04/2020,Yes,No,Success,20177868_14042020_prspl_doaoaawc,Yes
2015/7438,"Hanson Construction Materials Pty Ltd/Mining/Kwinana/Western Australia/Sand Mining 70/915 Banksia Road, Wellard, WA",Final recommendation report completed,09/04/2020,No,No,Not Applicable,Not Applicable,Not Applicable
2019/8575,Cherish Enterprises Pty Ltd/Residential Development/Springfield/Queensland/Springfield Residential Development,Decision on Assessment Approach: Preliminary Documentation,09/04/2020,Yes,No,Success,20198575_09042020_cepl_doaapd,Yes
2017/8052,"ROADS CORPORATION/Transport - Land/21A PARISH OF MARYVALE and 3C PARISH OF BOOLA BOOLA/Victoria/Latrobe River Bridge Replacement Project, Tyers Road, Vic",Final recommendation report completed,09/04/2020,No,No,Not Applicable,Not Applicable,Not Applicable
2019/8575,Cherish Enterprises Pty Ltd/Residential Development/Springfield/Queensland/Springfield Residential Development,Decision whether action needs approval/Approval Required,09/04/2020,Yes,No,Success,20198575_09042020_cepl_dwanaar,Yes
2017/7919,"KALBAR RESOURCES LTD./Mining/1265 Fernbank-Glenaladale Road, Fernbank, VIC, 3864/Victoria/Fingerboards Mineral Sands Project, East Gippsland, Vic",Change of Designated Proponent to: Kalbar Operations Pty Ltd,07/04/2020,Yes,No,Success,20177919_07042020_krl_codptkopl,Yes
2019/8606,VBX LIMITED/Mining/near Kalumburu/Western Australia/Wuudagu Bauxite Project,Invitation for Public Comment on Referral,07/04/2020,Yes,No,Success,20198606_07042020_vl_ifpcor,Yes
2017/8053,"CITY OF WANNEROO/Tourism and Recreation/Lot 8210, Deposited Plan 73880; Lot 9051, Deposited Plan 410670/Western Australia/Butler North District Open Space playing fields development, Wanneroo, WA",Assessment Process Notice: Extension of time in which to make a decision whether to approve a controlled action,06/04/2020,Yes,No,Success,20178053_06042020_cow_apneotiwtmadwtaaca,Yes
2018/8139,"JELLINBAH GROUP PTY LTD/Mining/Freeholds: 6 LR94, 100 SP230773, 2 SP213140, 3 SP213140/Queensland/Jellinbah Coal Mine-Central North Extension, QLD",Final recommendation report completed,03/04/2020,No,No,Not Applicable,Not Applicable,Not Applicable
2018/8289,"NEOEN AUSTRALIA PTY. LTD./Energy Generation and Supply (renewable)/Refer to Kaban Green Power Hub Matters of Environmental Significance Report, Section 1.4./Queensland/Kaban Green Power Hub, Kaban, Qld",Assessment Process Notice: Extension of time in which to make a decision whether to approve a controlled action,03/04/2020,Yes,No,Success,20188289_03042020_napl_apneotiwtmadwtaaca,Yes
2016/7845,"Hastings Technology Metals Ltd/Mining/Approximately 270km east-northeast of Carnavon/Western Australia/Yangibana Rare Earths Project, WA",Decision on approval of action: Approved with conditions,02/04/2020,Yes,No,Success,20167845_02042020_html_doaoaawc,Yes
2018/8236,"MARDIE MINERALS PTY LTD/Mining/Mining Tenements E08/2741, E08/2943, E08/2740 and E08/2836 /Western Australia/Mardie Project, 80 km south west of Karratha, WA",Notification of Variation to Proposal,02/04/2020,Yes,No,Success,20188236_02042020_mmpl_novtp,Yes
2010/5778,BYERWEN COAL PTY LTD/Mining/20km West of Glenden/Queensland/Develop the Byerwen Coal Mine,Notification of Variation to Approval,02/04/2020,Yes,No,Success,20105778_02042020_bcpl_novta,Yes
2011/6053,GRANGE RESOURCES LIMITED/Mining/Approx 90km east-north-east of Albany/Western Australia/Southdown Magnetite Project,Final recommendation report completed,02/04/2020,No,No,Not Applicable,Not Applicable,Not Applicable
2019/8581,"Drew Rolfe/Agriculture and Forestry/Wealwandangie Road, near Springsure/Queensland/Derrillo Irrigation Project",Invitation for Public Comment on Referral,01/04/2020,Yes,No,Success,20198581_01042020_dr_ifpcor,Yes
2019/8428,"DOHERTYS JUNCTION PTY LTD/Commercial Development/16 Dohertys Road, Laverton North, VIC, 3026/Victoria/Industrial Subdivision, 16-36 Dohertys Road, Laverton North, Vic",Decision on approval of action: Approved with conditions,01/04/2020,Yes,No,Success,20198428_01042020_djpl_doaoaawc,Yes
2020/8617,"Iluka Resources Limited/Mining/EL 5947 Yellabinna Regional Reserve and ML 6315, SA/South Australia/Atacama Mineral Sands Project, 200 km NW of Ceduna, SA",Invitation for Public Comment on Referral,01/04/2020,Yes,No,Success,20208617_01042020_irl_ifpcor,Yes
2019/8590,"Water NSW/Water Management and Use/The Peel River, downstream of Chaffey Dam to the confluence of the Peel and Namoi Rivers/New South Wales/Operation of Peel River Drought Protection Works",Notification of Publication of Preliminary Documentation: Invitation to Comment,31/03/2020,Yes,No,Success,20198590_31032020_wn_nopopditc,Yes
2018/8243,"BORAL RESOURCES (NSW) PTY LTD/Mining/Marulan South/New South Wales/Peppertree Quarry Modification 5, Marulan South, NSW",Decision on approval of action: Approved with conditions,31/03/2020,Yes,No,Success,20188243_31032020_brnpl_doaoaawc,Yes
2019/8522,"BORAL BRICKS WESTERN AUSTRALIA PTY LTD/Mining/Lot M1326/Western Australia/Boral Bricks Western Australia Pty Ltd, Muchea East Road, Muchea, Western Australia",Invitation for Public Comment on Referral,31/03/2020,Yes,No,Success,20198522_31032020_bbwapl_ifpcor,Yes
2017/8059,"WATER CORPORATION/Transport - Water/Shires of Donnybrook-Balingup and Bridgetown-Greenbushes/Western Australia/Greenbushes to Kirup Link, WA",Decision on approval of action: Approved with conditions,30/03/2020,Yes,No,Success,20178059_30032020_wc_doaoaawc,Yes
2018/8223,"ARROW ENERGY PTY LTD/Energy Generation and Supply (renewable)/51 Lots/Queensland/Surat Gas Project off-tenure pipelines, Surat Basin, Qld",Assessment Process Notice: Extension of time in which to make a decision whether to approve a controlled action,27/03/2020,Yes,No,Success,20188223_27032020_aepl_apneotiwtmadwtaaca,Yes
2019/8579,Lockyer Valley Regional Council/Tourism and Recreation/L902 SP309246/Queensland/Fairways Park,Invitation for Public Comment on Referral,27/03/2020,Yes,No,Success,20198579_27032020_lvrc_ifpcor,Yes
2019/8573,Department of Transport and Main Roads/Transport - Land/Bruce Highway between Smiths Gap and Friday Pocket Road/Queensland/Bruce Highway - Smiths Gap Overtaking Lane and Fauna Crossing,Invitation for Public Comment on Referral,27/03/2020,Yes,No,Success,20198573_27032020_dotamr_ifpcor,Yes
2017/7919,"KALBAR RESOURCES LTD./Mining/1265 Fernbank-Glenaladale Road, Fernbank, VIC, 3864/Victoria/Fingerboards Mineral Sands Project, East Gippsland, Vic",Change of person proposing to take action to: Kalbar Operations Pty Ltd,26/03/2020,Yes,No,Success,20177919_26032020_krl_coppttatkopl,Yes
2018/8223,"ARROW ENERGY PTY LTD/Energy Generation and Supply (renewable)/51 Lots/Queensland/Surat Gas Project off-tenure pipelines, Surat Basin, Qld",Final recommendation report completed,26/03/2020,No,No,Not Applicable,Not Applicable,Not Applicable
2019/8601,"ATLAS IRON LIMITED/Mining/Various mining tenements, Pilbara/Western Australia/Miralga Creek Project, Pilbara region, WA",Invitation for Public Comment on Referral,26/03/2020,Yes,No,Success,20198601_26032020_ail_ifpcor,Yes
2019/8589,Woolnorth Wind Farm Holding Pty Ltd/Energy Generation and Supply (renewable)/Near Mortlake/Victoria/Mt Fyans Wind Farm,Invitation for Public Comment on Referral,25/03/2020,Yes,No,Success,20198589_25032020_wwfhpl_ifpcor,Yes
2019/8577,"Melbourne Water Corporation/Water Management and Use/Crown Land, all managed by Melbourne Water/Victoria/WTP 115E Lagoon Seawall, Western Treatment Plant WTP, Werribee Victoria",Invitation for Public Comment on Referral,25/03/2020,Yes,No,Success,20198577_25032020_mwc_ifpcor,Yes
2008/4546,"BURRUP NITRATES PTY LTD/Manufacturing/King Bay/Hearson Cove Industrial Precinct, Burrup Peninsula/Western Australia/Proposed technical ammonium nitrate production facility",Notification of Variation to Approval,24/03/2020,Yes,No,Success,20084546_24032020_bnpl_novta,Yes
2019/8609,"Shire of Victoria Plains/Transport - Land/Lot 9001 on Deposited Plan 43363, Shire of Victoria Plains, and associated road reserves./Western Australia/Agricultural Lime Sands Route Upgrade, near Calingiri, WA",Decision whether action needs approval/Approval Not Required,20/03/2020,Yes,No,Success,20198609_20032020_sovp_dwanaanr,Yes
